{"id": 73, "sumodbId": 11918, "nskId": 3312, "shikonaEn": "Akua", "shikonaJp": "\u5929\u7a7a\u6d77\u3000\u7fd4\u99ac", "currentRank": "Juryo 10 East", "heya": "Tatsunami", "birthDate": "1990-11-06T00:00:00Z", "shusshin": "Ibaraki-ken, Higashiibaraki-gun, Oarai-machi", "height": 184, "weight": 168, "debut": "201011"}