{"id": 112, "sumodbId": 12729, "nskId": 4120, "shikonaEn": "Kotoeiho", "shikonaJp": "\u7434\u6804\u5cf0\u3000\u592e\u8d77", "currentRank": "Juryo 2 East", "heya": "Sadogatake", "birthDate": "2003-07-08T00:00:00Z", "shusshin": "Chiba-ken, Kashiwa-shi", "height": 184, "weight": 140, "debut": "202201"}
