{"id": 46, "sumodbId": 12107, "nskId": 3498, "shikonaEn": "Ichinojo", "shikonaJp": "\u9038\u30ce\u57ce", "currentRank": "Maegashira 13 West", "heya": "Minato", "birthDate": "1993-04-07T00:00:00Z", "shusshin": "Mongolia, Arkhangai", "height": 190, "weight": 183, "debut": "201311", "intai": "2023-05-04T00:00:00Z"}
