{"id": 184, "sumodbId": 11840, "nskId": 3250, "shikonaEn": "Chiyonoo", "shikonaJp": "\u5343\u4ee3\u30ce\u7687(\u3061\u3088\u306e\u304a\u3046)", "currentRank": "Makushita 40 East", "heya": "Kokonoe", "birthDate": "1991-05-29T00:00:00Z", "shusshin": "Okinawa-ken, Okinawa-shi - Kagoshima-ken, Oshima-gun, Yoron-cho", "height": 179.6, "weight": 142.3, "debut": "201003"}
