{"id": 24, "sumodbId": 12314, "nskId": 3705, "shikonaEn": "Hiradoumi", "shikonaJp": "\u5e73\u6238\u6d77\u3000\u96c4\u8cb4", "currentRank": "Maegashira 11 West", "heya": "Sakaigawa", "birthDate": "2000-04-20T00:00:00Z", "shusshin": "Nagasaki-ken, Hirado-shi", "height": 177, "weight": 129, "debut": "201603"}