{"id": 19, "sumodbId": 12451, "nskId": 3842, "shikonaEn": "Hoshoryu", "shikonaJp": "\u8c4a\u6607\u9f8d\u3000\u667a\u52dd", "currentRank": "Yokozuna 1 West", "heya": "Tatsunami", "birthDate": "1999-05-22T00:00:00Z", "shusshin": "Mongolia, Ulaanbaatar", "height": 188, "weight": 149, "debut": "201711"}
