{"id": 40, "sumodbId": 12351, "nskId": 3742, "shikonaEn": "Nishikifuji", "shikonaJp": "\u9326\u5bcc\u58eb\u3000\u9686\u8056", "currentRank": "Juryo 3 West", "heya": "Isegahama", "birthDate": "1996-07-22T00:00:00Z", "shusshin": "Aomori-ken, Towada-shi", "height": 184, "weight": 150, "debut": "201609"}
