{"id": 377, "sumodbId": 8899, "nskId": 3055, "shikonaEn": "Kyokutaisei", "shikonaJp": "\u65ed\u5927\u661f(\u304d\u3087\u304f\u305f\u3044\u305b\u3044)", "currentRank": "Makushita 35 West", "heya": "Oshima", "birthDate": "1989-10-18T00:00:00Z", "shusshin": "Hokkaido, Asahikawa-shi", "height": 184, "weight": 128.2, "debut": "200801"}