{"id": 38, "sumodbId": 11946, "nskId": 3337, "shikonaEn": "Meisei", "shikonaJp": "\u660e\u751f\u3000\u529b", "currentRank": "Maegashira 13 East", "heya": "Tatsunami", "birthDate": "1995-07-24T00:00:00Z", "shusshin": "Kagoshima-ken, Oshima-gun, Setouchi-cho", "height": 180, "weight": 152, "debut": "201105"}
