{"id": 73, "sumodbId": 11918, "nskId": 3312, "shikonaEn": "Akua", "shikonaJp": "\u5929\u7a7a\u6d77(\u3042\u304f\u3042)", "currentRank": "Makushita 13 West", "heya": "Tatsunami", "birthDate": "1990-11-06T00:00:00Z", "shusshin": "Ibaraki-ken, Higashiibaraki-gun, Oarai-machi", "height": 185.1, "weight": 172.3, "debut": "201011"}
