{"id": 109, "sumodbId": 8900, "nskId": 3056, "shikonaEn": "Akiseyama", "shikonaJp": "\u660e\u702c\u5c71", "currentRank": "Makushita 6 West", "heya": "Kise", "birthDate": "1985-07-18T00:00:00Z", "shusshin": "Aichi-ken, Kasugai-shi", "height": 182, "weight": 183, "debut": "200801", "intai": "2023-08-10T00:00:00Z"}