{"id": 12, "sumodbId": 12370, "nskId": 3761, "shikonaEn": "Wakatakakage", "shikonaJp": "\u82e5\u9686\u666f\u3000\u6e25", "currentRank": "Makushita 1 West", "heya": "Arashio", "birthDate": "1994-12-06T00:00:00Z", "shusshin": "Fukushima-ken, Fukushima-shi", "height": 180, "weight": 129, "debut": "201703"}
