{"id": 26, "sumodbId": 12210, "nskId": 3620, "shikonaEn": "Mitakeumi", "shikonaJp": "\u5fa1\u5dbd\u6d77\u3000\u4e45\u53f8", "currentRank": "Maegashira 9 West", "heya": "Dewanoumi", "birthDate": "1992-12-25T00:00:00Z", "shusshin": "Nagano-ken, Kiso-gun, Agematsu-machi", "height": 179, "weight": 172, "debut": "201503"}