{"id": 32, "sumodbId": 12406, "nskId": 3797, "shikonaEn": "Mitoryu", "shikonaJp": "\u6c34\u6238\u9f8d(\u307f\u3068\u308a\u3085\u3046)", "currentRank": "Makushita 7 West", "heya": "Nishikido", "birthDate": "1994-04-25T00:00:00Z", "shusshin": "Mongolia, Ulaanbaatar", "height": 190, "weight": 195, "debut": "201703"}
