{"id": 8850, "sumodbId": 12836, "nskId": 4227, "shikonaEn": "Onosato", "shikonaJp": "\u5927\u306e\u91cc\u3000\u6cf0\u8f1d", "currentRank": "Yokozuna 1 East", "heya": "Nishonoseki", "birthDate": "2000-06-07T00:00:00Z", "shusshin": "Ishikawa-ken, Kahoku-gun, Tsubata-machi", "height": 192, "weight": 183, "debut": "202305"}
