{"id": 64, "sumodbId": 12273, "nskId": 3665, "shikonaEn": "Daiamami", "shikonaJp": "\u5927\u5944\u7f8e(\u3060\u3044\u3042\u307e\u307f)", "currentRank": "Makushita 1 East", "heya": "Oitekaze", "birthDate": "1992-12-15T00:00:00Z", "shusshin": "Kagoshima-ken, Oshima-gun, Tatsugo-cho", "height": 185, "weight": 190, "debut": "201601"}
