{"id": 57, "sumodbId": 12013, "nskId": 3404, "shikonaEn": "Shimazuumi", "shikonaJp": "\u5cf6\u6d25\u6d77(\u3057\u307e\u3065\u3046\u307f)", "currentRank": "Makushita 20 East", "heya": "Hanaregoma", "birthDate": "1996-05-18T00:00:00Z", "shusshin": "Kagoshima-ken, Nishinoomote-shi", "height": 175.5, "weight": 155.6, "debut": "201203"}
