{"id": 298, "sumodbId": 7143, "nskId": 3002, "shikonaEn": "Amakaze", "shikonaJp": "\u5929\u98a8(\u3042\u307e\u304b\u305c)", "currentRank": "Makushita 40 West", "heya": "Oshiogawa", "birthDate": "1991-07-07T00:00:00Z", "shusshin": "Kagawa-ken, Nakatado-gun, Kotohira-cho", "height": 184, "weight": 200.5, "debut": "200703"}