{"id": 52, "sumodbId": 12117, "nskId": 3508, "shikonaEn": "Bushozan", "shikonaJp": "\u6b66\u5c06\u5c71\u3000\u864e\u592a\u90ce", "currentRank": "Juryo 2 East", "heya": "Fujishima", "birthDate": "1995-12-06T00:00:00Z", "shusshin": "Ibaraki-ken, Mito-shi", "height": 172, "weight": 170, "debut": "201401"}