{"id": 66, "sumodbId": 12548, "nskId": 3939, "shikonaEn": "Kitanowaka", "shikonaJp": "\u5317\u306e\u82e5\u3000\u5927\u8f14", "currentRank": "Maegashira 17 East", "heya": "Hakkaku", "birthDate": "2000-11-12T00:00:00Z", "shusshin": "Yamagata-ken, Sakata-shi", "height": 190, "weight": 146, "debut": "201903"}