{"id": 8854, "sumodbId": 12839, "nskId": 4230, "shikonaEn": "Aonishiki", "shikonaJp": "\u5b89\u9752\u9326\u3000\u65b0\u5927", "currentRank": "Komusubi 1 West", "heya": "Ajigawa", "birthDate": "2004-03-23T00:00:00Z", "shusshin": "Ukraine, Vinnytsia Oblast", "height": 182, "weight": 136, "debut": "202307"}
