{"id": 368, "sumodbId": 12051, "nskId": 3442, "shikonaEn": "Ishiura", "shikonaJp": "\u77f3\u6d66", "currentRank": "Jonokuchi 15 West", "heya": "Miyagino", "birthDate": "1990-01-10T00:00:00Z", "shusshin": "Tottori-ken, Tottori-shi", "height": 174, "weight": 110, "debut": "201301", "intai": "2023-06-01T00:00:00Z"}