{"id": 10, "sumodbId": 12043, "nskId": 3434, "shikonaEn": "Onosho", "shikonaJp": "\u963f\u6b66\u54b2\u3000\u594e\u4e5f", "currentRank": "Maegashira 14 West", "heya": "Onomatsu", "birthDate": "1996-07-04T00:00:00Z", "shusshin": "Aomori-ken, Kitatsugaru-gun, Nakadomari-machi", "height": 176, "weight": 148.5, "debut": "201301"}
